{
  "schemaVersion": 1,
  "files": [
    "biome-colors.json"
  ],
  "defaults": {},
  "rules": [
    {
      "id": "builtin:overworld",
      "priority": -1000,
      "match": {
        "kind": "dimension",
        "dimension": "minecraft:overworld"
      },
      "style": {
        "title": "OVERWORLD",
        "texture": "travelerstitlesgtnh:textures/titles/atlas_01.png",
        "textureU0": 0.028645833333333332,
        "textureV0": 0.1357421875,
        "textureU1": 0.498046875,
        "textureV1": 0.2587890625,
        "imageWidth": 181,
        "imageHeight": 32,
        "decoration": false,
        "showSubtitle": true,
        "biomeSubtitleColor": true
      }
    },
    {
      "id": "builtin:the_nether",
      "priority": -1000,
      "match": {
        "kind": "dimension",
        "dimension": "minecraft:the_nether"
      },
      "style": {
        "title": "THE NETHER",
        "texture": "travelerstitlesgtnh:textures/titles/atlas_01.png",
        "textureU0": 0.5286458333333334,
        "textureV0": 0.1357421875,
        "textureU1": 0.96875,
        "textureV1": 0.2626953125,
        "imageWidth": 169,
        "imageHeight": 33,
        "decoration": false,
        "showSubtitle": true,
        "biomeSubtitleColor": true
      }
    },
    {
      "id": "builtin:the_end",
      "priority": -1000,
      "match": {
        "kind": "dimension",
        "dimension": "minecraft:the_end"
      },
      "style": {
        "title": "THE END",
        "texture": "travelerstitlesgtnh:textures/titles/atlas_01.png",
        "textureU0": 0.06575520833333333,
        "textureV0": 0.4150390625,
        "textureU1": 0.4498697916666667,
        "textureV1": 0.53515625,
        "imageWidth": 148,
        "imageHeight": 31,
        "decoration": false,
        "showSubtitle": true,
        "biomeSubtitleColor": true
      }
    },
    {
      "id": "builtin:twilight_forest",
      "priority": -1000,
      "match": {
        "kind": "dimension",
        "dimension": "twilightforest:twilight_forest"
      },
      "style": {
        "title": "TWILIGHT FOREST",
        "texture": "travelerstitlesgtnh:textures/titles/atlas_01.png",
        "textureU0": 0.5319010416666666,
        "textureV0": 0.373046875,
        "textureU1": 0.9524739583333334,
        "textureV1": 0.5849609375,
        "imageWidth": 162,
        "imageHeight": 55,
        "decoration": false,
        "showSubtitle": true,
        "biomeSubtitleColor": true
      }
    },
    {
      "id": "builtin:personal_space",
      "priority": -1000,
      "match": {
        "kind": "dimension",
        "dimension": "personalspace:personal_space"
      },
      "style": {
        "title": "PERSONAL SPACE",
        "texture": "travelerstitlesgtnh:textures/titles/atlas_01.png",
        "textureU0": 0.015625,
        "textureV0": 0.7041015625,
        "textureU1": 0.513671875,
        "textureV1": 0.833984375,
        "imageWidth": 192,
        "imageHeight": 34,
        "decoration": false,
        "showSubtitle": true,
        "biomeSubtitleColor": true
      }
    },
    {
      "id": "builtin:toxic_everglades",
      "priority": -1000,
      "match": {
        "kind": "dimension",
        "dimension": "gtnh:toxic_everglades"
      },
      "style": {
        "title": "TOXIC EVERGLADES",
        "texture": "travelerstitlesgtnh:textures/titles/atlas_01.png",
        "textureU0": 0.54296875,
        "textureV0": 0.6669921875,
        "textureU1": 0.9596354166666666,
        "textureV1": 0.890625,
        "imageWidth": 160,
        "imageHeight": 58,
        "decoration": false,
        "showSubtitle": true,
        "biomeSubtitleColor": true
      }
    },
    {
      "id": "builtin:deep_dark",
      "priority": -1000,
      "match": {
        "kind": "dimension",
        "dimension": "extrautilities:deep_dark"
      },
      "style": {
        "title": "DEEP DARK",
        "texture": "travelerstitlesgtnh:textures/titles/atlas_02.png",
        "textureU0": 0.03125,
        "textureV0": 0.1298828125,
        "textureU1": 0.4993489583333333,
        "textureV1": 0.251953125,
        "imageWidth": 180,
        "imageHeight": 32,
        "decoration": false,
        "showSubtitle": true,
        "biomeSubtitleColor": true
      }
    },
    {
      "id": "builtin:last_millennium",
      "priority": -1000,
      "match": {
        "kind": "dimension",
        "dimension": "extrautilities:last_millennium"
      },
      "style": {
        "title": "LAST MILLENNIUM",
        "texture": "travelerstitlesgtnh:textures/titles/atlas_02.png",
        "textureU0": 0.5227864583333334,
        "textureV0": 0.0869140625,
        "textureU1": 0.9791666666666666,
        "textureV1": 0.28125,
        "imageWidth": 176,
        "imageHeight": 50,
        "decoration": false,
        "showSubtitle": true,
        "biomeSubtitleColor": true
      }
    },
    {
      "id": "builtin:outer_lands",
      "priority": -1000,
      "match": {
        "kind": "dimension",
        "dimension": "thaumcraft:outer_lands"
      },
      "style": {
        "title": "OUTER LANDS",
        "texture": "travelerstitlesgtnh:textures/titles/atlas_02.png",
        "textureU0": 0.0234375,
        "textureV0": 0.4072265625,
        "textureU1": 0.5104166666666666,
        "textureV1": 0.5302734375,
        "imageWidth": 187,
        "imageHeight": 32,
        "decoration": false,
        "showSubtitle": true,
        "biomeSubtitleColor": true
      }
    },
    {
      "id": "builtin:dream_world",
      "priority": -1000,
      "match": {
        "kind": "dimension",
        "dimension": "witchery:dream_world"
      },
      "style": {
        "title": "DREAM WORLD",
        "texture": "travelerstitlesgtnh:textures/titles/atlas_02.png",
        "textureU0": 0.5618489583333334,
        "textureV0": 0.3671875,
        "textureU1": 0.9453125,
        "textureV1": 0.5810546875,
        "imageWidth": 148,
        "imageHeight": 55,
        "decoration": false,
        "showSubtitle": true,
        "biomeSubtitleColor": true
      }
    },
    {
      "id": "builtin:torment",
      "priority": -1000,
      "match": {
        "kind": "dimension",
        "dimension": "witchery:torment"
      },
      "style": {
        "title": "TORMENT",
        "texture": "travelerstitlesgtnh:textures/titles/atlas_02.png",
        "textureU0": 0.036458333333333336,
        "textureV0": 0.6875,
        "textureU1": 0.494140625,
        "textureV1": 0.8193359375,
        "imageWidth": 176,
        "imageHeight": 34,
        "decoration": false,
        "showSubtitle": true,
        "biomeSubtitleColor": true
      }
    },
    {
      "id": "builtin:mirror_world",
      "priority": -1000,
      "match": {
        "kind": "dimension",
        "dimension": "witchery:mirror"
      },
      "style": {
        "title": "MIRROR WORLD",
        "texture": "travelerstitlesgtnh:textures/titles/atlas_02.png",
        "textureU0": 0.552734375,
        "textureV0": 0.6630859375,
        "textureU1": 0.9453125,
        "textureV1": 0.87890625,
        "imageWidth": 151,
        "imageHeight": 56,
        "decoration": false,
        "showSubtitle": true,
        "biomeSubtitleColor": true
      }
    },
    {
      "id": "builtin:moon",
      "priority": -1000,
      "match": {
        "kind": "dimension",
        "body": "moon.moon"
      },
      "style": {
        "title": "MOON",
        "texture": "travelerstitlesgtnh:textures/titles/atlas_03.png",
        "textureU0": 0.07747395833333333,
        "textureV0": 0.1181640625,
        "textureU1": 0.4427083333333333,
        "textureV1": 0.26171875,
        "imageWidth": 141,
        "imageHeight": 37,
        "decoration": false,
        "showSubtitle": true,
        "biomeSubtitleColor": true
      }
    },
    {
      "id": "builtin:mars",
      "priority": -1000,
      "match": {
        "kind": "dimension",
        "body": "planet.mars"
      },
      "style": {
        "title": "MARS",
        "texture": "travelerstitlesgtnh:textures/titles/atlas_03.png",
        "textureU0": 0.560546875,
        "textureV0": 0.1181640625,
        "textureU1": 0.931640625,
        "textureV1": 0.26171875,
        "imageWidth": 143,
        "imageHeight": 37,
        "decoration": false,
        "showSubtitle": true,
        "biomeSubtitleColor": true
      }
    },
    {
      "id": "builtin:mercury",
      "priority": -1000,
      "match": {
        "kind": "dimension",
        "body": "planet.mercury"
      },
      "style": {
        "title": "MERCURY",
        "texture": "travelerstitlesgtnh:textures/titles/atlas_03.png",
        "textureU0": 0.02734375,
        "textureV0": 0.404296875,
        "textureU1": 0.509765625,
        "textureV1": 0.5419921875,
        "imageWidth": 186,
        "imageHeight": 36,
        "decoration": false,
        "showSubtitle": true,
        "biomeSubtitleColor": true
      }
    },
    {
      "id": "builtin:venus",
      "priority": -1000,
      "match": {
        "kind": "dimension",
        "body": "planet.venus"
      },
      "style": {
        "title": "VENUS",
        "texture": "travelerstitlesgtnh:textures/titles/atlas_03.png",
        "textureU0": 0.544921875,
        "textureV0": 0.40625,
        "textureU1": 0.947265625,
        "textureV1": 0.5458984375,
        "imageWidth": 155,
        "imageHeight": 36,
        "decoration": false,
        "showSubtitle": true,
        "biomeSubtitleColor": true
      }
    },
    {
      "id": "builtin:phobos",
      "priority": -1000,
      "match": {
        "kind": "dimension",
        "body": "moon.Phobos"
      },
      "style": {
        "title": "PHOBOS",
        "texture": "travelerstitlesgtnh:textures/titles/atlas_03.png",
        "textureU0": 0.046223958333333336,
        "textureV0": 0.67578125,
        "textureU1": 0.48046875,
        "textureV1": 0.8134765625,
        "imageWidth": 167,
        "imageHeight": 36,
        "decoration": false,
        "showSubtitle": true,